<!ELEMENT products (product+)>
<!ELEMENT product (code, price, colors)>
<!ELEMENT code (#PCDATA)>
<!ELEMENT price (#PCDATA)>
<!ELEMENT colors (color+)>
<!ELEMENT color (#PCDATA)>